<?xml version="1.0" encoding="UTF-8"?>
<!--
   Copyright 2009 Anyware Services

   Licensed under the Apache License, Version 2.0 (the "License");
   you may not use this file except in compliance with the License.
   You may obtain a copy of the License at

       http://www.apache.org/licenses/LICENSE-2.0

   Unless required by applicable law or agreed to in writing, software
   distributed under the License is distributed on an "AS IS" BASIS,
   WITHOUT WARRANTIES OR CONDITIONS OF ANY KIND, either express or implied.
   See the License for the specific language governing permissions and
   limitations under the License.
   -->

<!-- 
    Init class needed for test
    Use the JDBC CredentialAware Modifiable User manager
-->
<runtime xmlns:xsi="http://www.w3.org/2001/XMLSchema-instance" 
         xsi:noNamespaceSchemaLocation="http://ametys.org/Runtime/1.2/runtime.xsd">
    
    <application>
        <version>2.0.1</version>
        <date>20070115T2215 GMT</date>
    </application>
    
    <initClass>org.ametys.runtime.test.Init</initClass>
    
    <incompleteConfig>
        <allowedURLs>
            <allowedURL>_admin/public</allowedURL>
        	<allowedURL>_admin/resources</allowedURL>
        	<allowedURL>_admin/_plugins/core/administrator/config</allowedURL>
        	<allowedURL>_admin/plugins/core/administrator/config</allowedURL>
        </allowedURLs>
        <redirectURL>cocoon://_admin/public/load-config.html?uri=core/administrator/config/edit.html</redirectURL>
    </incompleteConfig>
    
    <plugins>
        <exclude>
            <feature>test</feature>
        </exclude>
        <locations>
            <location>test</location>
        </locations>
    </plugins>
    
    <workspaces default="myworkspace">
        <exclude>
            <workspace>test</workspace>
        </exclude>
    </workspaces>
    
    <extensions>
        <org.ametys.runtime.right.RightsManager>org.ametys.runtime.plugins.core.right.DefaultProfileBased</org.ametys.runtime.right.RightsManager>
        <org.ametys.runtime.exception.ExceptionHandler>org.ametys.runtime.plugins.core.exception.Default</org.ametys.runtime.exception.ExceptionHandler>
        <org.ametys.runtime.group.GroupsManager>org.ametys.runtime.plugins.core.group.Empty</org.ametys.runtime.group.GroupsManager>
        <org.ametys.runtime.authentication.CredentialsProvider>org.ametys.runtime.plugins.core.authentication.Basic</org.ametys.runtime.authentication.CredentialsProvider>
        <org.ametys.runtime.user.UsersManager>org.ametys.runtime.plugins.core.user.CoreModifiableCredentialsAwareJdbc</org.ametys.runtime.user.UsersManager>
    </extensions>
</runtime>
