<?xml version="1.0" encoding="UTF-8"?>
<!--
   Copyright 2009 Anyware Services

   Licensed under the Apache License, Version 2.0 (the "License");
   you may not use this file except in compliance with the License.
   You may obtain a copy of the License at

       http://www.apache.org/licenses/LICENSE-2.0

   Unless required by applicable law or agreed to in writing, software
   distributed under the License is distributed on an "AS IS" BASIS,
   WITHOUT WARRANTIES OR CONDITIONS OF ANY KIND, either express or implied.
   See the License for the specific language governing permissions and
   limitations under the License.
   -->

<!-- 
    Init class needed for test
    Minimal runtime that use default extensions and no db
-->
<runtime xmlns:xsi="http://www.w3.org/2001/XMLSchema-instance" 
         xsi:noNamespaceSchemaLocation="http://ametys.org/Runtime/1.2/runtime.xsd">
    
    <application>
        <version>2.0.1</version>
    </application>
    
    <initClass>org.ametys.runtime.test.Init</initClass>
    
    <plugins>
        <exclude>
            <feature>core/runtime.datasource.core</feature>
            <feature>core/runtime.upload</feature>
        </exclude>
    </plugins>
    
    <incompleteConfig>
        <allowedURLs/>
        <redirectURL/>
    </incompleteConfig>
    
    <extensions>
    	<org.ametys.runtime.plugins.core.userpref.UserPreferencesManager>org.ametys.runtime.plugins.core.userpref.EmptyUserPreferencesManager</org.ametys.runtime.plugins.core.userpref.UserPreferencesManager>
    </extensions>
</runtime>
