<?xml version="1.0" encoding="UTF-8"?>
<!-- 
    Location needed for test
-->
<runtime  xmlns:xsi="http://www.w3.org/2001/XMLSchema-instance" 
          xsi:noNamespaceSchemaLocation="http://ametys.org/Runtime/1.0/runtime.xsd">
    
    <application>
        <version>2.0.1</version>
    </application>
    
    <plugins>
        <locations>
            <location>location1</location>
        </locations>
    </plugins>
    
    <incompleteConfig>
        <allowedURLs/>
        <redirectURL/>
    </incompleteConfig>
</runtime>
